{
  "$schema": "../_schema/module.schema.json",
  "id": "battery-d-1.5v",
  "name": "D battery",
  "subtitle": "1.5 V alkaline, flying leads",
  "category": "misc",
  "tags": [
    "alkaline",
    "d-cell",
    "primary",
    "1.5v",
    "battery",
    "cell"
  ],
  "designator": "BT",
  "footprint": {
    "cols": 6,
    "rows": 1
  },
  "pins": [
    {
      "col": 0,
      "row": 0,
      "name": "-",
      "number": 1,
      "type": "gnd"
    },
    {
      "col": 5,
      "row": 0,
      "name": "+",
      "number": 2,
      "type": "power"
    }
  ],
  "shapes": [
    {
      "type": "line",
      "x1": 0,
      "y1": 0,
      "x2": 0.72,
      "y2": 0,
      "stroke": "#1b1f25",
      "strokeWidth": 0.09,
      "linecap": "round"
    },
    {
      "type": "line",
      "x1": 5,
      "y1": 0,
      "x2": 4.28,
      "y2": 0,
      "stroke": "#d84040",
      "strokeWidth": 0.09,
      "linecap": "round"
    },
    {
      "type": "rect",
      "x": 0.7,
      "y": -0.75,
      "w": 3.6,
      "h": 1.5,
      "fill": "#e8c72c",
      "rx": 0.675,
      "stroke": "#a89020",
      "strokeWidth": 0.035
    },
    {
      "type": "rect",
      "x": 0.7,
      "y": -0.75,
      "w": 0.22,
      "h": 1.5,
      "fill": "#8d949c",
      "rx": 0.05,
      "stroke": "#a89020",
      "strokeWidth": 0.035
    },
    {
      "type": "rect",
      "x": 4.08,
      "y": -0.75,
      "w": 0.22,
      "h": 1.5,
      "fill": "#3a3f47",
      "rx": 0.05,
      "stroke": "#a89020",
      "strokeWidth": 0.035
    }
  ],
  "label": {
    "text": "1.5 V",
    "x": 2.5,
    "y": -1.03,
    "size": 0.28,
    "color": "#9fb0c0"
  }
}
