{
  "$schema": "../_schema/module.schema.json",
  "id": "mq-7",
  "name": "MQ-7 gas sensor",
  "subtitle": "carbon monoxide",
  "category": "sensor",
  "tags": [
    "gas",
    "air",
    "analog",
    "mq-7",
    "module"
  ],
  "designator": "U",
  "footprint": {
    "cols": 8,
    "rows": 12
  },
  "pins": [
    {
      "col": 0,
      "row": 0,
      "name": "AO",
      "type": "signal"
    },
    {
      "col": 1,
      "row": 0,
      "name": "DO",
      "type": "signal"
    },
    {
      "col": 2,
      "row": 0,
      "name": "GND",
      "type": "gnd"
    },
    {
      "col": 3,
      "row": 0,
      "name": "VCC",
      "type": "power"
    }
  ],
  "body": {
    "x": -0.45,
    "y": -0.45,
    "w": 7.9,
    "h": 11.9,
    "rx": 0.16,
    "fill": "#123a63",
    "stroke": "#0a2440"
  },
  "shapes": [
    {
      "type": "rect",
      "x": -0.32,
      "y": -0.32,
      "w": 3.64,
      "h": 0.64,
      "fill": "#23272e",
      "rx": 0.08,
      "stroke": "#0b0e12",
      "strokeWidth": 0.035
    },
    {
      "type": "rect",
      "x": 1.92,
      "y": 5.5,
      "w": 3.16,
      "h": 4.046,
      "fill": "#1f242b",
      "rx": 0.08,
      "stroke": "#0b0e12",
      "strokeWidth": 0.035
    },
    {
      "type": "circle",
      "cx": -0.02,
      "cy": -0.02,
      "r": 0.1,
      "fill": "#e8c72c"
    },
    {
      "type": "circle",
      "cx": 3.5,
      "cy": 6,
      "r": 2.4,
      "fill": "#9aa2ab",
      "stroke": "#6f767e",
      "strokeWidth": 0.08
    },
    {
      "type": "circle",
      "cx": 3.5,
      "cy": 6,
      "r": 1.7,
      "fill": "#7f868e",
      "stroke": "#5c6269",
      "strokeWidth": 0.05
    }
  ],
  "label": {
    "text": "MQ-7",
    "size": 0.6,
    "color": "#e8eef4",
    "x": 3.5,
    "y": 11.15
  }
}
