{
  "$schema": "../_schema/module.schema.json",
  "id": "s8550",
  "name": "S8550",
  "subtitle": "PNP, 25 V / 700 mA",
  "category": "discrete",
  "tags": [
    "pnp",
    "to-92",
    "through-hole"
  ],
  "designator": "Q",
  "footprint": {
    "cols": 3,
    "rows": 1
  },
  "pins": [
    {
      "col": 0,
      "row": 0,
      "name": "E",
      "number": 1,
      "type": "signal"
    },
    {
      "col": 1,
      "row": 0,
      "name": "B",
      "number": 2,
      "type": "signal"
    },
    {
      "col": 2,
      "row": 0,
      "name": "C",
      "number": 3,
      "type": "signal"
    }
  ],
  "shapes": [
    {
      "type": "line",
      "x1": 0,
      "y1": 0,
      "x2": 0,
      "y2": -0.35,
      "stroke": "#b9c0c8",
      "strokeWidth": 0.1,
      "linecap": "round"
    },
    {
      "type": "line",
      "x1": 1,
      "y1": 0,
      "x2": 1,
      "y2": -0.35,
      "stroke": "#b9c0c8",
      "strokeWidth": 0.1,
      "linecap": "round"
    },
    {
      "type": "line",
      "x1": 2,
      "y1": 0,
      "x2": 2,
      "y2": -0.35,
      "stroke": "#b9c0c8",
      "strokeWidth": 0.1,
      "linecap": "round"
    },
    {
      "type": "path",
      "d": "M -0.02 -0.4 A 1.02 1.02 0 0 1 2.02 -0.4 L 2.02 -0.62 A 1.02 1.02 0 0 0 -0.02 -0.62 Z",
      "fill": "#23272e",
      "stroke": "#0e1116",
      "strokeWidth": 0.04
    },
    {
      "type": "path",
      "d": "M -0.02 -0.4 A 1.02 1.02 0 0 1 2.02 -0.4 Z",
      "fill": "#23272e",
      "stroke": "#0e1116",
      "strokeWidth": 0.04
    },
    {
      "type": "text",
      "x": 1,
      "y": -0.72,
      "text": "S8550",
      "size": 0.3,
      "color": "#c9d2dc",
      "anchor": "middle",
      "weight": 600
    }
  ]
}
