{
  "$schema": "../_schema/module.schema.json",
  "id": "vibration-sw18010",
  "name": "Vibration switch SW-18010P",
  "subtitle": "spring vibration sensor",
  "category": "sensor",
  "tags": [
    "vibration",
    "shock",
    "switch",
    "spring"
  ],
  "designator": "SW",
  "footprint": {
    "cols": 2,
    "rows": 1
  },
  "pins": [
    {
      "col": 0,
      "row": 0,
      "name": "1",
      "number": 1,
      "type": "signal"
    },
    {
      "col": 1,
      "row": 0,
      "name": "2",
      "number": 2,
      "type": "signal"
    }
  ],
  "shapes": [
    {
      "type": "line",
      "x1": 0,
      "y1": 0,
      "x2": 0,
      "y2": -0.6,
      "stroke": "#a8b0b8",
      "strokeWidth": 0.1,
      "linecap": "round"
    },
    {
      "type": "line",
      "x1": 1,
      "y1": 0,
      "x2": 1,
      "y2": -0.6,
      "stroke": "#a8b0b8",
      "strokeWidth": 0.1,
      "linecap": "round"
    },
    {
      "type": "rect",
      "x": -0.28,
      "y": -2.4,
      "w": 1.56,
      "h": 1.8,
      "fill": "#b9c0c8",
      "rx": 0.7,
      "stroke": "#7f868e",
      "strokeWidth": 0.035
    },
    {
      "type": "line",
      "x1": 0.5,
      "y1": -2.2,
      "x2": 0.5,
      "y2": -0.8,
      "stroke": "#6f767e",
      "strokeWidth": 0.08,
      "linecap": "round"
    }
  ],
  "label": {
    "text": "VIB",
    "x": 0.5,
    "y": 0.44,
    "size": 0.28,
    "color": "#9fb0c0"
  }
}
