{
  "$schema": "../_schema/module.schema.json",
  "id": "irfz44n",
  "name": "IRFZ44N",
  "subtitle": "N-MOSFET, 55 V / 49 A",
  "category": "discrete",
  "tags": [
    "mosfet",
    "n-channel",
    "power",
    "to-220",
    "through-hole"
  ],
  "designator": "Q",
  "footprint": {
    "cols": 3,
    "rows": 1
  },
  "pins": [
    {
      "col": 0,
      "row": 0,
      "name": "G",
      "number": 1,
      "type": "gnd"
    },
    {
      "col": 1,
      "row": 0,
      "name": "D",
      "number": 2,
      "type": "signal"
    },
    {
      "col": 2,
      "row": 0,
      "name": "S",
      "number": 3,
      "type": "signal"
    }
  ],
  "shapes": [
    {
      "type": "line",
      "x1": 0,
      "y1": 0,
      "x2": 0,
      "y2": -0.4,
      "stroke": "#b9c0c8",
      "strokeWidth": 0.11,
      "linecap": "round"
    },
    {
      "type": "line",
      "x1": 1,
      "y1": 0,
      "x2": 1,
      "y2": -0.4,
      "stroke": "#b9c0c8",
      "strokeWidth": 0.11,
      "linecap": "round"
    },
    {
      "type": "line",
      "x1": 2,
      "y1": 0,
      "x2": 2,
      "y2": -0.4,
      "stroke": "#b9c0c8",
      "strokeWidth": 0.11,
      "linecap": "round"
    },
    {
      "type": "rect",
      "x": -0.5,
      "y": -1.62,
      "w": 3,
      "h": 1.22,
      "fill": "#23272e",
      "rx": 0.08,
      "stroke": "#0e1116",
      "strokeWidth": 0.035
    },
    {
      "type": "rect",
      "x": -0.5,
      "y": -1.98,
      "w": 3,
      "h": 0.4,
      "fill": "#8c949d",
      "rx": 0.06,
      "stroke": "#6b737b",
      "strokeWidth": 0.035
    },
    {
      "type": "circle",
      "cx": 1,
      "cy": -1.78,
      "r": 0.14,
      "fill": "#4c5359"
    },
    {
      "type": "text",
      "x": 1,
      "y": -1.02,
      "text": "IRFZ44N",
      "size": 0.32,
      "color": "#c9d2dc",
      "anchor": "middle",
      "weight": 600
    }
  ]
}
