{
  "$schema": "../_schema/module.schema.json",
  "id": "lcd1602",
  "name": "LCD 16×2",
  "subtitle": "HD44780 character LCD",
  "category": "display",
  "tags": [
    "lcd",
    "hd44780",
    "character",
    "1602",
    "module"
  ],
  "designator": "U",
  "footprint": {
    "cols": 32,
    "rows": 14
  },
  "pins": [
    {
      "col": 0,
      "row": 0,
      "name": "VSS",
      "type": "gnd"
    },
    {
      "col": 1,
      "row": 0,
      "name": "VDD",
      "type": "power"
    },
    {
      "col": 2,
      "row": 0,
      "name": "V0",
      "type": "signal"
    },
    {
      "col": 3,
      "row": 0,
      "name": "RS",
      "type": "signal"
    },
    {
      "col": 4,
      "row": 0,
      "name": "RW",
      "type": "signal"
    },
    {
      "col": 5,
      "row": 0,
      "name": "E",
      "type": "signal"
    },
    {
      "col": 6,
      "row": 0,
      "name": "D0",
      "type": "io"
    },
    {
      "col": 7,
      "row": 0,
      "name": "D1",
      "type": "io"
    },
    {
      "col": 8,
      "row": 0,
      "name": "D2",
      "type": "io"
    },
    {
      "col": 9,
      "row": 0,
      "name": "D3",
      "type": "io"
    },
    {
      "col": 10,
      "row": 0,
      "name": "D4",
      "type": "io"
    },
    {
      "col": 11,
      "row": 0,
      "name": "D5",
      "type": "io"
    },
    {
      "col": 12,
      "row": 0,
      "name": "D6",
      "type": "io"
    },
    {
      "col": 13,
      "row": 0,
      "name": "D7",
      "type": "io"
    },
    {
      "col": 14,
      "row": 0,
      "name": "A",
      "type": "power"
    },
    {
      "col": 15,
      "row": 0,
      "name": "K",
      "type": "gnd"
    }
  ],
  "body": {
    "x": -0.45,
    "y": -0.45,
    "w": 31.9,
    "h": 13.9,
    "rx": 0.16,
    "fill": "#12503c",
    "stroke": "#0a3527"
  },
  "shapes": [
    {
      "type": "rect",
      "x": -0.32,
      "y": -0.32,
      "w": 15.64,
      "h": 0.64,
      "fill": "#23272e",
      "rx": 0.08,
      "stroke": "#0b0e12",
      "strokeWidth": 0.035
    },
    {
      "type": "rect",
      "x": 9.12,
      "y": 6.5,
      "w": 12.76,
      "h": 4.726,
      "fill": "#1f242b",
      "rx": 0.08,
      "stroke": "#0b0e12",
      "strokeWidth": 0.035
    },
    {
      "type": "circle",
      "cx": -0.02,
      "cy": -0.02,
      "r": 0.1,
      "fill": "#e8c72c"
    },
    {
      "type": "rect",
      "x": 3,
      "y": 4,
      "w": 26,
      "h": 7.5,
      "fill": "#2f6b4f",
      "rx": 0.15,
      "stroke": "#1d4433",
      "strokeWidth": 0.035
    },
    {
      "type": "rect",
      "x": 4.2,
      "y": 4.9,
      "w": 23.6,
      "h": 5.7,
      "fill": "#5fbf8f",
      "rx": 0.1,
      "stroke": "#3d8f68",
      "strokeWidth": 0.035
    }
  ],
  "label": {
    "text": "LCD 1602",
    "size": 0.7,
    "color": "#e8eef4",
    "x": 15.5,
    "y": 13.15
  }
}
