{
  "$schema": "../_schema/module.schema.json",
  "id": "inductor-470uh",
  "name": "Inductor 470µH",
  "subtitle": "axial choke",
  "category": "passive",
  "tags": [
    "inductor",
    "choke",
    "coil",
    "470uh"
  ],
  "designator": "L",
  "footprint": {
    "cols": 3,
    "rows": 1
  },
  "resize": {
    "axis": "cols",
    "min": 3,
    "max": 8
  },
  "pins": [
    {
      "col": 0,
      "row": 0,
      "name": "1",
      "number": 1,
      "type": "signal"
    },
    {
      "col": 2,
      "row": 0,
      "name": "2",
      "number": 2,
      "type": "signal"
    }
  ],
  "shapes": [
    {
      "type": "line",
      "x1": 0,
      "y1": 0,
      "x2": 0.55,
      "y2": 0,
      "stroke": "#a8b0b8",
      "strokeWidth": 0.1,
      "linecap": "round"
    },
    {
      "type": "line",
      "x1": 2,
      "y1": 0,
      "x2": 1.45,
      "y2": 0,
      "stroke": "#a8b0b8",
      "strokeWidth": 0.1,
      "linecap": "round"
    },
    {
      "type": "rect",
      "x": 0.5,
      "y": -0.3,
      "w": 1,
      "h": 0.6,
      "fill": "#3f3128",
      "rx": 0.26,
      "stroke": "#241a14",
      "strokeWidth": 0.035
    },
    {
      "type": "rect",
      "x": 0.62,
      "y": -0.28,
      "w": 0.1,
      "h": 0.56,
      "fill": "#e8c72c"
    },
    {
      "type": "rect",
      "x": 0.82,
      "y": -0.28,
      "w": 0.1,
      "h": 0.56,
      "fill": "#14171a"
    },
    {
      "type": "rect",
      "x": 1.02,
      "y": -0.28,
      "w": 0.1,
      "h": 0.56,
      "fill": "#6b4a2b"
    }
  ],
  "label": {
    "text": "470µH",
    "x": 1.0,
    "y": -0.52,
    "size": 0.28,
    "color": "#9fb0c0"
  }
}
