{
  "$schema": "../_schema/module.schema.json",
  "id": "attiny85-digispark",
  "name": "Digispark",
  "subtitle": "ATtiny85 USB board",
  "category": "mcu",
  "tags": [
    "attiny85",
    "digispark",
    "usb",
    "module"
  ],
  "designator": "U",
  "footprint": {
    "cols": 6,
    "rows": 5
  },
  "pins": [
    {
      "col": 0,
      "row": 0,
      "name": "P5",
      "type": "io"
    },
    {
      "col": 1,
      "row": 0,
      "name": "P4",
      "type": "io"
    },
    {
      "col": 2,
      "row": 0,
      "name": "P3",
      "type": "io"
    },
    {
      "col": 3,
      "row": 0,
      "name": "P2",
      "type": "io"
    },
    {
      "col": 4,
      "row": 0,
      "name": "P1",
      "type": "io"
    },
    {
      "col": 5,
      "row": 0,
      "name": "P0",
      "type": "io"
    }
  ],
  "body": {
    "x": -0.45,
    "y": -0.45,
    "w": 5.9,
    "h": 4.9,
    "rx": 0.16,
    "fill": "#6b1622",
    "stroke": "#4a0f18"
  },
  "shapes": [
    {
      "type": "rect",
      "x": -0.32,
      "y": -0.32,
      "w": 5.64,
      "h": 0.64,
      "fill": "#23272e",
      "rx": 0.08,
      "stroke": "#0b0e12",
      "strokeWidth": 0.035
    },
    {
      "type": "rect",
      "x": 1.32,
      "y": 2,
      "w": 2.36,
      "h": 1.666,
      "fill": "#1f242b",
      "rx": 0.08,
      "stroke": "#0b0e12",
      "strokeWidth": 0.035
    },
    {
      "type": "circle",
      "cx": -0.02,
      "cy": -0.02,
      "r": 0.1,
      "fill": "#e8c72c"
    }
  ],
  "label": {
    "text": "DIGISPARK",
    "size": 0.34,
    "color": "#e8eef4",
    "x": 2.5,
    "y": 4.15
  }
}
